order_id,order_date,customer_id,product_id,units_ordered,remarks
26,12/2/2021,75,92,363,"Donec diam neque, vestibulum eget, vulputate ut, ultrices vel, augue. Vestibulum ante ipsum primis in faucibus orci luctus et ultrices posuere cubilia Curae; Donec pharetra, magna vestibulum aliquet ultrices, erat tortor sollicitudin mi, sit amet lobortis sapien sapien non mi. Integer ac neque."
27,8/14/2021,79,68,269,Duis bibendum. Morbi non quam nec dui luctus rutrum. Nulla tellus.
28,9/20/2021,62,74,115,Nullam sit amet turpis elementum ligula vehicula consequat. Morbi a ipsum. Integer a nibh.
29,7/17/2021,59,61,274,Maecenas ut massa quis augue luctus tincidunt. Nulla mollis molestie lorem. Quisque ut erat.
30,1/15/2022,54,91,355,"Quisque id justo sit amet sapien dignissim vestibulum. Vestibulum ante ipsum primis in faucibus orci luctus et ultrices posuere cubilia Curae; Nulla dapibus dolor vel est. Donec odio justo, sollicitudin ut, suscipit a, feugiat et, eros."
31,1/24/2022,87,47,379,Pellentesque at nulla. Suspendisse potenti. Cras in purus eu magna vulputate luctus.
32,10/22/2021,47,95,376,"Curabitur at ipsum ac tellus semper interdum. Mauris ullamcorper purus sit amet nulla. Quisque arcu libero, rutrum ac, lobortis vel, dapibus at, diam."
33,5/3/2021,16,73,467,Etiam vel augue. Vestibulum rutrum rutrum neque. Aenean auctor gravida sem.
34,1/25/2022,74,95,309,Aenean lectus. Pellentesque eget nunc. Donec quis orci eget orci vehicula condimentum.
35,3/28/2021,100,90,201,Aenean lectus. Pellentesque eget nunc. Donec quis orci eget orci vehicula condimentum.
36,6/15/2021,41,22,423,"Cras mi pede, malesuada in, imperdiet et, commodo vulputate, justo. In blandit ultrices enim. Lorem ipsum dolor sit amet, consectetuer adipiscing elit."
37,11/11/2021,42,10,226,"Cras mi pede, malesuada in, imperdiet et, commodo vulputate, justo. In blandit ultrices enim. Lorem ipsum dolor sit amet, consectetuer adipiscing elit."
38,9/15/2021,73,90,378,Praesent id massa id nisl venenatis lacinia. Aenean sit amet justo. Morbi ut odio.
39,3/26/2021,31,41,242,"Curabitur gravida nisi at nibh. In hac habitasse platea dictumst. Aliquam augue quam, sollicitudin vitae, consectetuer eget, rutrum at, lorem."
40,4/26/2021,89,40,218,"Praesent blandit. Nam nulla. Integer pede justo, lacinia eget, tincidunt eget, tempus vel, pede."
41,9/15/2021,85,3,205,"Praesent blandit. Nam nulla. Integer pede justo, lacinia eget, tincidunt eget, tempus vel, pede."
42,5/18/2021,50,74,322,In hac habitasse platea dictumst. Etiam faucibus cursus urna. Ut tellus.
43,2/14/2022,64,7,319,"Fusce posuere felis sed lacus. Morbi sem mauris, laoreet ut, rhoncus aliquet, pulvinar sed, nisl. Nunc rhoncus dui vel sem."
44,9/27/2021,98,82,133,"Sed sagittis. Nam congue, risus semper porta volutpat, quam pede lobortis ligula, sit amet eleifend pede libero quis orci. Nullam molestie nibh in lectus."
45,10/8/2021,91,74,499,"Cum sociis natoque penatibus et magnis dis parturient montes, nascetur ridiculus mus. Vivamus vestibulum sagittis sapien. Cum sociis natoque penatibus et magnis dis parturient montes, nascetur ridiculus mus."
46,3/7/2021,46,63,113,"Nam ultrices, libero non mattis pulvinar, nulla pede ullamcorper augue, a suscipit nulla elit ac nulla. Sed vel enim sit amet nunc viverra dapibus. Nulla suscipit ligula in lacus."
47,5/18/2021,78,40,242,Duis aliquam convallis nunc. Proin at turpis a pede posuere nonummy. Integer non velit.
48,7/16/2021,8,33,475,Duis aliquam convallis nunc. Proin at turpis a pede posuere nonummy. Integer non velit.
49,11/8/2021,62,46,334,"In sagittis dui vel nisl. Duis ac nibh. Fusce lacus purus, aliquet at, feugiat non, pretium quis, lectus."
50,7/9/2021,61,49,386,Cras non velit nec nisi vulputate nonummy. Maecenas tincidunt lacus at velit. Vivamus vel nulla eget eros elementum pellentesque.
